{
  "$schema": "https://ph7x.com/schemas/m365-governance/evidence/2.0.0",
  "provenance": {
    "collected_at": "2026-08-06T16:55:00Z",
    "collector": "spo-collector",
    "collector_version": "0.10.0",
    "source_system": "SharePoint Online",
    "source_api": "PnP.PowerShell / CSOM",
    "tenant": {
      "id": null,
      "host": "contoso.sharepoint.com"
    },
    "identity_kind": "delegated",
    "acquisition": "collected",
    "scopes": [
      "AllSites.Read"
    ]
  },
  "coverage": {
    "requested": [
      "classification"
    ],
    "completed": [
      "classification"
    ],
    "unavailable": {}
  },
  "resource": {
    "id": "contoso,site,unlabelled",
    "type": "site",
    "scope": "collection",
    "parent": "contoso.sharepoint.com",
    "display_name": "Brand Guide",
    "url": "https://contoso.sharepoint.com/sites/BrandGuide"
  },
  "facts": {
    "classification": {
      "label_applied": {
        "state": "observed",
        "value": false,
        "raw": {
          "field": "SensitivityLabelInfo.Id",
          "value": false
        }
      },
      "label_id": {
        "state": "missing",
        "detail": "No sensitivity label is applied to this site, so there is no id to report."
      },
      "label_name": {
        "state": "missing",
        "detail": "No sensitivity label is applied, so there is no name to resolve."
      },
      "label_resolved": {
        "state": "missing",
        "detail": "No label is applied, so there is nothing to resolve."
      },
      "classification_set": {
        "state": "observed",
        "value": false,
        "raw": {
          "field": "Classification",
          "value": false
        }
      },
      "site_classification": {
        "state": "missing",
        "detail": "No classification string is set on this site."
      },
      "group_connected": {
        "state": "observed",
        "value": false,
        "raw": {
          "field": "GroupId",
          "value": false
        }
      },
      "group_id": {
        "state": "missing",
        "detail": "This site is not connected to a Microsoft 365 group."
      },
      "teams_connected": {
        "state": "not-supported",
        "detail": "IsTeamsConnected is a property of the tenant record, and this mode reads the site. See group_connected, which is observable without administrative rights."
      },
      "classified": {
        "state": "observed",
        "value": false,
        "raw": {
          "field": "SensitivityLabelInfo.Id or Classification",
          "value": false
        }
      }
    }
  }
}
