{
  "$schema": "https://ph7x.com/schemas/m365-governance/evidence/2.0.0",
  "provenance": {
    "collected_at": "2026-08-08T09:00:00Z",
    "collector": "spo-collector",
    "collector_version": "0.3.0",
    "source_system": "SharePoint Online",
    "source_api": "PnP.PowerShell / SharePoint Admin",
    "tenant": {
      "id": null,
      "host": "contoso.sharepoint.com"
    },
    "identity_kind": "application",
    "acquisition": "collected",
    "scopes": [
      "Sites.Read.All"
    ]
  },
  "coverage": {
    "requested": [
      "tenant_sharing"
    ],
    "completed": [
      "tenant_sharing"
    ],
    "unavailable": {}
  },
  "resource": {
    "id": "contoso.sharepoint.com",
    "type": "tenant",
    "scope": "tenant",
    "parent": null,
    "display_name": "https://northwind-admin.sharepoint.com",
    "url": "https://northwind-admin.sharepoint.com"
  },
  "facts": {
    "tenant_sharing": {
      "capability": {
        "state": "observed",
        "value": "Disabled",
        "raw": {
          "field": "SharingCapability",
          "value": "Disabled"
        }
      },
      "default_link_type": {
        "state": "observed",
        "value": "Direct",
        "raw": {
          "field": "DefaultSharingLinkType",
          "value": "Direct"
        }
      },
      "file_anonymous_link_type": {
        "state": "missing",
        "detail": "FileAnonymousLinkType was not returned for this tenant."
      }
    }
  }
}
