{
  "$schema": "https://ph7x.com/schemas/m365-governance/evidence/2.0.0",
  "provenance": {
    "collected_at": "2026-08-06T15:30:00Z",
    "collector": "spo-collector",
    "collector_version": "0.3.0",
    "source_system": "SharePoint Online",
    "source_api": "PnP.PowerShell / CSOM",
    "tenant": {
      "id": null,
      "host": "contoso.sharepoint.com"
    },
    "identity_kind": "delegated",
    "acquisition": "collected",
    "scopes": [
      "AllSites.Read"
    ]
  },
  "coverage": {
    "requested": [
      "activity"
    ],
    "completed": [
      "activity"
    ],
    "unavailable": {}
  },
  "resource": {
    "id": "contoso,site,archived",
    "type": "site",
    "scope": "collection",
    "parent": "contoso.sharepoint.com",
    "display_name": "Archive 2023",
    "url": "https://contoso.sharepoint.com/sites/archived"
  },
  "facts": {
    "activity": {
      "last_user_modified": {
        "state": "observed",
        "value": "2023-12-11T08:00:00Z",
        "raw": {
          "field": "LastItemUserModifiedDate",
          "value": "2023-12-11T08:00:00Z"
        }
      },
      "last_item_modified": {
        "state": "observed",
        "value": "2026-08-06T15:30:33Z",
        "raw": {
          "field": "LastItemModifiedDate",
          "value": "2026-08-06T15:30:33Z"
        }
      },
      "created": {
        "state": "observed",
        "value": "2024-02-01T09:00:00Z",
        "raw": {
          "field": "Created",
          "value": "2024-02-01T09:00:00Z"
        }
      },
      "days_since_user_change": {
        "state": "observed",
        "value": 969,
        "raw": {
          "field": "LastItemUserModifiedDate vs collected_at",
          "value": 969
        }
      },
      "lock_state": {
        "state": "observed",
        "value": "Unlock",
        "raw": {
          "field": "LockState",
          "value": "Unlock"
        }
      },
      "archive_status": {
        "state": "observed",
        "value": "FullyArchived",
        "raw": {
          "field": "ArchiveStatus",
          "value": "FullyArchived"
        }
      },
      "changeable": {
        "state": "observed",
        "value": false,
        "raw": {
          "field": "LockState + ArchiveStatus",
          "value": false
        }
      }
    }
  }
}
