{
  "$schema": "https://ph7x.com/schemas/m365-governance/evidence/2.0.0",
  "provenance": {
    "collected_at": "2026-08-06T15:00:00Z",
    "collector": "spo-collector",
    "collector_version": "0.3.0",
    "source_system": "SharePoint Online",
    "source_api": "PnP.PowerShell / CSOM",
    "tenant": {
      "id": null,
      "host": "contoso.sharepoint.com"
    },
    "identity_kind": "delegated",
    "acquisition": "collected",
    "scopes": [
      "AllSites.Read"
    ]
  },
  "coverage": {
    "requested": [
      "web",
      "pages"
    ],
    "completed": [
      "web",
      "pages"
    ],
    "unavailable": {}
  },
  "resource": {
    "id": "contoso,site,finance-sub",
    "type": "site",
    "scope": "collection",
    "parent": "contoso.sharepoint.com",
    "display_name": "Finance",
    "url": "https://contoso.sharepoint.com/sites/finance"
  },
  "facts": {
    "web": {
      "template": {
        "state": "observed",
        "value": "SITEPAGEPUBLISHING",
        "raw": {
          "field": "WebTemplate",
          "value": "SITEPAGEPUBLISHING"
        }
      },
      "configuration": {
        "state": "observed",
        "value": "0",
        "raw": {
          "field": "Configuration",
          "value": "0"
        }
      },
      "master_url": {
        "state": "observed",
        "value": "/sites/finance/_catalogs/masterpage/seattle.master",
        "raw": {
          "field": "MasterUrl",
          "value": "/sites/finance/_catalogs/masterpage/seattle.master"
        }
      },
      "custom_master_url": {
        "state": "observed",
        "value": "/sites/finance/_catalogs/masterpage/seattle.master",
        "raw": {
          "field": "CustomMasterUrl",
          "value": "/sites/finance/_catalogs/masterpage/seattle.master"
        }
      },
      "alternate_css_url": {
        "state": "observed",
        "value": "",
        "raw": {
          "field": "AlternateCssUrl",
          "value": ""
        }
      },
      "master_page_file": {
        "state": "observed",
        "value": "seattle.master",
        "raw": {
          "field": "MasterUrl (file)",
          "value": "seattle.master"
        }
      },
      "custom_master_page_file": {
        "state": "observed",
        "value": "seattle.master",
        "raw": {
          "field": "CustomMasterUrl (file)",
          "value": "seattle.master"
        }
      },
      "web_feature_ids": {
        "state": "observed",
        "value": [
          "B77B6484-364E-4356-8C72-1BB55B81C6B3"
        ],
        "raw": {
          "field": "Feature.DefinitionId (Web)",
          "value": [
            "B77B6484-364E-4356-8C72-1BB55B81C6B3"
          ]
        }
      },
      "site_feature_ids": {
        "state": "observed",
        "value": [
          "B77B6484-364E-4356-8C72-1BB55B81C6B3"
        ],
        "raw": {
          "field": "Feature.DefinitionId (Site)",
          "value": [
            "B77B6484-364E-4356-8C72-1BB55B81C6B3"
          ]
        }
      }
    },
    "pages": {
      "modern_observed": {
        "state": "observed",
        "value": 9,
        "raw": {
          "field": "Get-PnPPage",
          "value": 9
        }
      },
      "in_library": {
        "state": "observed",
        "value": 9,
        "raw": {
          "field": "SitePages.ItemCount",
          "value": 9
        }
      },
      "in_library_not_returned_as_modern": {
        "state": "observed",
        "value": 0,
        "raw": {
          "field": "SitePages.ItemCount - Get-PnPPage",
          "value": 0
        }
      }
    }
  }
}
